{
  "$schema": "https://json-schema.org/draft/2020-12/schema",
  "title": "Explicit public task specification",
  "type": "object",
  "required": ["task_id", "system_prompt", "user_prompt", "tools", "scoring"],
  "additionalProperties": false,
  "properties": {
    "task_id": {"type": "string", "minLength": 1},
    "description": {"type": "string"},
    "system_prompt": {"type": "string"},
    "user_prompt": {"type": "string"},
    "inputs": {"type": "object", "additionalProperties": {"type": "string"}},
    "tools": {"type": "array", "items": {"type": "object", "required": ["type", "function"], "properties": {"type": {"const": "function"}, "function": {"type": "object", "required": ["name", "parameters"]}}}},
    "scoring": {"type": "object", "description": "Evaluator-only configuration, excluded from model messages and tool replies.", "required": ["kind", "expected"], "properties": {"kind": {"enum": ["numeric", "exact_text"]}, "expected": {"type": ["number", "string"]}, "absolute_tolerance": {"type": "number", "minimum": 0}}}
  }
}
